<?xml version="1.0" encoding="UTF-8"?>
<exitpoints xmlns:xsi="http://www.w3.org/2001/XMLSchema-instance"
	xsi:noNamespaceSchemaLocation="exit_point_schema.xsd">
	<!-- -1 Anything is valid. -->
	<!-- 0 Only sanitized values are valid. -->
	<!-- 1 LITERAL and sanitized values are valid. -->
	<!-- X1;X2;... These are the accepted values. -->
	<exitpoint id="01">
		<qualifiedname><![CDATA[javax.naming.directory.InitialDirContext]]></qualifiedname>
		<methodname>InitialDirContext</methodname>
		<parameters type="java.lang.Object" rules="1" />
	</exitpoint>
	<exitpoint id="02">
		<qualifiedname><![CDATA[javax.naming.directory.InitialDirContext]]></qualifiedname>
		<methodname>search</methodname>
		<parameters type="java.lang.Object" rules="1" />
		<parameters type="java.lang.Object" rules="1" />
	</exitpoint>
	<exitpoint id="03">
		<qualifiedname><![CDATA[javax.naming.directory.InitialDirContext]]></qualifiedname>
		<methodname>search</methodname>
		<parameters type="java.lang.Object" rules="1" />
		<parameters type="java.lang.Object" rules="1" />
		<parameters type="java.lang.Object" rules="1" />
	</exitpoint>
	<exitpoint id="04">
		<qualifiedname><![CDATA[javax.naming.directory.InitialDirContext]]></qualifiedname>
		<methodname>search</methodname>
		<parameters type="java.lang.Object" rules="1" />
		<parameters type="java.lang.Object" rules="1" />
		<parameters type="java.lang.Object" rules="1" />
		<parameters type="java.lang.Object" rules="1" />
	</exitpoint>
	<exitpoint id="05">
		<qualifiedname><![CDATA[javax.naming.directory.SearchControls]]></qualifiedname>
		<methodname>setReturningAttributes</methodname>
		<parameters type="java.lang.Object" rules="1" />
	</exitpoint>
	<exitpoint id="06">
		<qualifiedname><![CDATA[com.novell.ldap.LDAPConnection]]></qualifiedname>
		<methodname>connect</methodname>
		<parameters type="java.lang.String" rules="1" />
		<parameters type="java.lang.Object" rules="1" />
	</exitpoint>
	<exitpoint id="07">
		<qualifiedname><![CDATA[com.novell.ldap.LDAPConnection]]></qualifiedname>
		<methodname>search</methodname>
		<parameters type="java.lang.String" rules="1" />
		<parameters type="java.lang.Object" rules="1" />
		<parameters type="java.lang.String" rules="1" />
		<parameters type="java.lang.Object" rules="1" />
		<parameters type="java.lang.Object" rules="1" />
	</exitpoint>
	<exitpoint id="08">
		<qualifiedname><![CDATA[com.novell.ldap.LDAPConnection]]></qualifiedname>
		<methodname>search</methodname>
		<parameters type="java.lang.String" rules="1" />
		<parameters type="java.lang.Object" rules="1" />
		<parameters type="java.lang.String" rules="1" />
		<parameters type="java.lang.Object" rules="1" />
		<parameters type="java.lang.Object" rules="1" />
		<parameters type="java.lang.Object" rules="1" />
	</exitpoint>
</exitpoints>