<?xml version="1.0" encoding="UTF-8"?>
<exitpoints xmlns:xsi="http://www.w3.org/2001/XMLSchema-instance"
	xsi:noNamespaceSchemaLocation="exit_point_schema.xsd">
	<!-- -1 Anything is valid. -->
	<!-- 0 Only sanitized values are valid. -->
	<!-- 1 LITERAL and sanitized values are valid. -->
	<!-- X1;X2;... These are the accepted values. -->
	<!-- java.io.PrintWriter -->
	<exitpoint id="01">
		<qualifiedname>java.io.PrintWriter</qualifiedname>
		<methodname>print</methodname>
		<parameters type="java.lang.String" rules="1" />
	</exitpoint>
	<exitpoint id="02">
		<qualifiedname>java.io.PrintWriter</qualifiedname>
		<methodname>print</methodname>
		<parameters type="java.lang.Object" rules="1" />
	</exitpoint>
	<exitpoint id="03">
		<qualifiedname>java.io.PrintWriter</qualifiedname>
		<methodname>println</methodname>
		<parameters type="java.lang.String" rules="1" />
	</exitpoint>
	<exitpoint id="04">
		<qualifiedname>java.io.PrintWriter</qualifiedname>
		<methodname>println</methodname>
		<parameters type="java.lang.Object" rules="1" />
	</exitpoint>
	<!-- java.io.PrintStream -->
	<exitpoint id="05">
		<qualifiedname>java.io.PrintStream</qualifiedname>
		<methodname>print</methodname>
		<parameters type="java.lang.String" rules="1" />
	</exitpoint>
	<exitpoint id="06">
		<qualifiedname>java.io.PrintStream</qualifiedname>
		<methodname>print</methodname>
		<parameters type="java.lang.Object" rules="1" />
	</exitpoint>
	<exitpoint id="07">
		<qualifiedname>java.io.PrintStream</qualifiedname>
		<methodname>println</methodname>
		<parameters type="java.lang.String" rules="1" />
	</exitpoint>
	<exitpoint id="08">
		<qualifiedname>java.io.PrintStream</qualifiedname>
		<methodname>println</methodname>
		<parameters type="java.lang.Object" rules="1" />
	</exitpoint>
	<!-- javax.servlet.ServletOutputStream -->
	<exitpoint id="09">
		<qualifiedname>javax.servlet.ServletOutputStream</qualifiedname>
		<methodname>print</methodname>
		<parameters type="java.lang.String" rules="1" />
	</exitpoint>
	<exitpoint id="10">
		<qualifiedname>javax.servlet.ServletOutputStream</qualifiedname>
		<methodname>println</methodname>
		<parameters type="java.lang.String" rules="1" />
	</exitpoint>
	<!-- javax.servlet.jsp.JspWriter -->
	<exitpoint id="11">
		<qualifiedname>javax.servlet.jsp.JspWriter</qualifiedname>
		<methodname>print</methodname>
		<parameters type="java.lang.String" rules="1" />
	</exitpoint>
	<exitpoint id="12">
		<qualifiedname>javax.servlet.jsp.JspWriter</qualifiedname>
		<methodname>println</methodname>
		<parameters type="java.lang.String" rules="1" />
	</exitpoint>
	<!-- javax.servlet.http.HttpServletRequest -->
	<exitpoint id="13">
		<qualifiedname>javax.servlet.(http.Http)?ServletRequest</qualifiedname>
		<methodname>setAttribute</methodname>
		<parameters type="java.lang.String" rules="1" />
		<parameters type="java.lang.Object" rules="1" />
	</exitpoint>
	<exitpoint id="14">
		<qualifiedname>javax.servlet.(http.Http)?ServletRequest</qualifiedname>
		<methodname>setCharacterEncoding</methodname>
		<parameters type="java.lang.String" rules="1" />
	</exitpoint>
	<!-- javax.servlet.http.HttpServletResponse -->
	<exitpoint id="15">
		<qualifiedname>javax.servlet.(http.Http)?ServletResponse</qualifiedname>
		<methodname>sendError</methodname>
		<parameters type="java.lang.Object" rules="-1" />
		<parameters type="java.lang.String" rules="1" />
	</exitpoint>
	<exitpoint id="16">
		<qualifiedname>javax.servlet.(http.Http)?ServletResponse</qualifiedname>
		<methodname>setDateHeader</methodname>
		<parameters type="java.lang.String" rules="1" />
		<parameters type="java.lang.Object" rules="-1" />
	</exitpoint>
	<exitpoint id="17">
		<qualifiedname>javax.servlet.(http.Http)?ServletResponse</qualifiedname>
		<methodname>addDateHeader</methodname>
		<parameters type="java.lang.String" rules="1" />
		<parameters type="java.lang.Object" rules="-1" />
	</exitpoint>
	<exitpoint id="18">
		<qualifiedname>javax.servlet.(http.Http)?ServletResponse</qualifiedname>
		<methodname>setHeader</methodname>
		<parameters type="java.lang.String" rules="1" />
		<parameters type="java.lang.String" rules="1" />
	</exitpoint>
	<exitpoint id="19">
		<qualifiedname>javax.servlet.(http.Http)?ServletResponse</qualifiedname>
		<methodname>addHeader</methodname>
		<parameters type="java.lang.String" rules="1" />
		<parameters type="java.lang.String" rules="1" />
	</exitpoint>
	<exitpoint id="20">
		<qualifiedname>javax.servlet.(http.Http)?ServletResponse</qualifiedname>
		<methodname>setIntHeader</methodname>
		<parameters type="java.lang.String" rules="1" />
		<parameters type="java.lang.Object" rules="-1" />
	</exitpoint>
	<exitpoint id="21">
		<qualifiedname>javax.servlet.(http.Http)?ServletResponse</qualifiedname>
		<methodname>addIntHeader</methodname>
		<parameters type="java.lang.String" rules="1" />
		<parameters type="java.lang.Object" rules="-1" />
	</exitpoint>
	<!-- javax.servlet.ServletResponse -->
	<exitpoint id="22">
		<qualifiedname>javax.servlet.(http.Http)?ServletResponse</qualifiedname>
		<methodname>setCharacterEncoding</methodname>
		<parameters type="java.lang.String" rules="1" />
	</exitpoint>
	<exitpoint id="23">
		<qualifiedname>javax.servlet.(http.Http)?ServletResponse</qualifiedname>
		<methodname>setContentType</methodname>
		<parameters type="java.lang.String" rules="1" />
	</exitpoint>
</exitpoints>