<?xml version="1.0" encoding="UTF-8"?>
<exitpoints xmlns:xsi="http://www.w3.org/2001/XMLSchema-instance"
	xsi:noNamespaceSchemaLocation="exit_point_schema.xsd">
	<!-- -1 Anything is valid. -->
	<!-- 0 Only sanitized values are valid. -->
	<!-- 1 LITERAL and sanitized values are valid. -->
	<!-- X1;X2;... These are the accepted values. -->
	<!-- java.lang.Runtime -->
	<exitpoint id="01">
		<qualifiedname>java.lang.Runtime</qualifiedname>
		<methodname>exec</methodname>
		<parameters type="java.lang.Object" rules="1" />
	</exitpoint>
	<exitpoint id="02">
		<qualifiedname>java.lang.Runtime</qualifiedname>
		<methodname>exec</methodname>
		<parameters type="java.lang.Object" rules="1" />
		<parameters type="java.lang.Object" rules="1" />
	</exitpoint>
	<exitpoint id="03">
		<qualifiedname>java.lang.Runtime</qualifiedname>
		<methodname>exec</methodname>
		<parameters type="java.lang.Object" rules="1" />
		<parameters type="java.lang.Object" rules="1" />
		<parameters type="java.lang.String" rules="1" />
	</exitpoint>
</exitpoints>