<?xml version="1.0" encoding="UTF-8"?>
<exitpoints xmlns:xsi="http://www.w3.org/2001/XMLSchema-instance"
	xsi:noNamespaceSchemaLocation="exit_point_schema.xsd">
	<!-- -1 Anything is valid. -->
	<!-- 0 Only sanitized values are valid. -->
	<!-- 1 LITERAL and sanitized values are valid. -->
	<!-- X1;X2;... These are the accepted values. -->
	<!-- javax.xml.xpath.XPath -->
	<exitpoint id="01">
		<qualifiedname><![CDATA[javax.xml.xpath.XPath]]></qualifiedname>
		<methodname>compile</methodname>
		<parameters type="java.lang.String" rules="1" />
	</exitpoint>
	<exitpoint id="02">
		<qualifiedname><![CDATA[javax.xml.xpath.XPath]]></qualifiedname>
		<methodname>evaluate</methodname>
		<parameters type="java.lang.String" rules="1" />
		<parameters type="java.lang.Object" rules="1" />
	</exitpoint>
	<exitpoint id="03">
		<qualifiedname><![CDATA[javax.xml.xpath.XPath]]></qualifiedname>
		<methodname>evaluate</methodname>
		<parameters type="java.lang.String" rules="1" />
		<parameters type="java.lang.Object" rules="1" />
		<parameters type="java.lang.Object" rules="1" />
	</exitpoint>
	<exitpoint id="04">
		<qualifiedname><![CDATA[javax.xml.xpath.XPathExpression]]></qualifiedname>
		<methodname>evaluate</methodname>
		<parameters type="java.lang.Object" rules="1" />
	</exitpoint>
	<exitpoint id="05">
		<qualifiedname><![CDATA[javax.xml.xpath.XPathExpression]]></qualifiedname>
		<methodname>evaluate</methodname>
		<parameters type="java.lang.Object" rules="1" />
		<parameters type="java.lang.Object" rules="1" />
	</exitpoint>
	<!-- org.apache.xpath.XPath -->
	<exitpoint id="04">
		<qualifiedname><![CDATA[org.apache.xpath.XPath]]></qualifiedname>
		<methodname>XPath</methodname>
		<parameters type="java.lang.String" rules="1" />
		<parameters type="java.lang.Object" rules="1" />
		<parameters type="java.lang.Object" rules="1" />
		<parameters type="java.lang.Object" rules="1" />
	</exitpoint>
	<exitpoint id="05">
		<qualifiedname><![CDATA[org.apache.xpath.XPath]]></qualifiedname>
		<methodname>XPath</methodname>
		<parameters type="java.lang.String" rules="1" />
		<parameters type="java.lang.Object" rules="1" />
		<parameters type="java.lang.Object" rules="1" />
		<parameters type="java.lang.Object" rules="1" />
		<parameters type="java.lang.Object" rules="1" />
	</exitpoint>
	<exitpoint id="06">
		<qualifiedname><![CDATA[org.apache.xpath.XPath]]></qualifiedname>
		<methodname>XPath</methodname>
		<parameters type="java.lang.String" rules="1" />
		<parameters type="java.lang.Object" rules="1" />
		<parameters type="java.lang.Object" rules="1" />
		<parameters type="java.lang.Object" rules="1" />
		<parameters type="java.lang.Object" rules="1" />
		<parameters type="java.lang.Object" rules="1" />
	</exitpoint>
	<!-- org.apache.commons.jxpath.JXPath -->
	<exitpoint id="07">
		<qualifiedname><![CDATA[org.apache.commons.jxpath.JXPath]]></qualifiedname>
		<methodname>getValue</methodname>
		<parameters type="java.lang.String" rules="1" />
	</exitpoint>
	<!-- org.xmldb.api.modules.XPathQueryService -->
	<exitpoint id="08">
		<qualifiedname><![CDATA[org.xmldb.api.modules.XPathQueryService]]></qualifiedname>
		<methodname>query</methodname>
		<parameters type="java.lang.String" rules="1" />
	</exitpoint>
	<exitpoint id="09">
		<qualifiedname><![CDATA[org.xmldb.api.modules.XPathQueryService]]></qualifiedname>
		<methodname>query</methodname>
		<parameters type="java.lang.String" rules="1" />
		<parameters type="java.lang.String" rules="1" />
	</exitpoint>
	<!-- org.xmldb.api.modules.XMLResource -->
	<exitpoint id="10">
		<qualifiedname><![CDATA[org.xmldb.api.modules.XMLResource]]></qualifiedname>
		<methodname>setContent</methodname>
		<parameters type="java.lang.String" rules="1" />
	</exitpoint>
</exitpoints>