<?xml version="1.0" encoding="UTF-8"?>
<exitpoints xmlns:xsi="http://www.w3.org/2001/XMLSchema-instance"
	xsi:noNamespaceSchemaLocation="exit_point_schema.xsd">
	<!-- ANYTHING_IS_VALID(1), SANITIZED(2), LITERAL(4), STRING_CONCATENATION(8); -->

	<!-- java.sql.(Prepared)?Statement -->
	<exitpoint id="01">
		<qualifiedname><![CDATA[java.sql.(Prepared)?Statement]]></qualifiedname>
		<methodname>addBatch</methodname>
		<parameters type="java.lang.String" rules="14" />
	</exitpoint>
	<exitpoint id="02">
		<qualifiedname><![CDATA[java.sql.(Prepared)?Statement]]></qualifiedname>
		<methodname>execute</methodname>
		<parameters type="java.lang.String" rules="14" />
	</exitpoint>
	<exitpoint id="03">
		<qualifiedname><![CDATA[java.sql.(Prepared)?Statement]]></qualifiedname>
		<methodname>execute</methodname>
		<parameters type="java.lang.String" rules="14" />
		<parameters type="java.lang.Object" rules="1" />
	</exitpoint>
	<exitpoint id="04">
		<qualifiedname><![CDATA[java.sql.(Prepared)?Statement]]></qualifiedname>
		<methodname>executeQuery</methodname>
		<parameters type="java.lang.String" rules="14" />
	</exitpoint>
	<exitpoint id="05">
		<qualifiedname><![CDATA[java.sql.(Prepared)?Statement]]></qualifiedname>
		<methodname>executeUpdate</methodname>
		<parameters type="java.lang.String" rules="14" />
	</exitpoint>
	<exitpoint id="06">
		<qualifiedname><![CDATA[java.sql.(Prepared)?Statement]]></qualifiedname>
		<methodname>executeUpdate</methodname>
		<parameters type="java.lang.String" rules="14" />
		<parameters type="java.lang.Object" rules="1" />
	</exitpoint>
	<!-- java.sql.Connection -->
	<exitpoint id="07">
		<qualifiedname><![CDATA[java.sql.Connection]]></qualifiedname>
		<methodname>prepareStatement</methodname>
		<parameters type="java.lang.String" rules="14" />
	</exitpoint>
	<exitpoint id="08">
		<qualifiedname><![CDATA[java.sql.Connection]]></qualifiedname>
		<methodname>prepareStatement</methodname>
		<parameters type="java.lang.String" rules="14" />
		<parameters type="java.lang.Object" rules="1" />
	</exitpoint>
	<exitpoint id="09">
		<qualifiedname><![CDATA[java.sql.Connection]]></qualifiedname>
		<methodname>prepareCall</methodname>
		<parameters type="java.lang.String" rules="14" />
	</exitpoint>
	<exitpoint id="10">
		<qualifiedname><![CDATA[java.sql.Connection]]></qualifiedname>
		<methodname>prepareCall</methodname>
		<parameters type="java.lang.String" rules="14" />
		<parameters type="java.lang.Object" rules="1" />
		<parameters type="java.lang.Object" rules="1" />
	</exitpoint>
	<exitpoint id="11">
		<qualifiedname><![CDATA[java.sql.Connection]]></qualifiedname>
		<methodname>prepareCall</methodname>
		<parameters type="java.lang.String" rules="14" />
		<parameters type="java.lang.Object" rules="1" />
		<parameters type="java.lang.Object" rules="1" />
		<parameters type="java.lang.Object" rules="1" />
	</exitpoint>
	<!-- javax.persistence.EntityManager -->
	<exitpoint id="12">
		<qualifiedname><![CDATA[javax.persistence.EntityManager]]></qualifiedname>
		<methodname>createNativeQuery</methodname>
		<parameters type="java.lang.String" rules="14" />
	</exitpoint>
	<exitpoint id="13">
		<qualifiedname><![CDATA[javax.persistence.EntityManager]]></qualifiedname>
		<methodname>createNativeQuery</methodname>
		<parameters type="java.lang.String" rules="14" />
		<parameters type="java.lang.Object" rules="14" />
	</exitpoint>
	<exitpoint id="14">
		<qualifiedname><![CDATA[javax.persistence.EntityManager]]></qualifiedname>
		<methodname>createQuery</methodname>
		<parameters type="java.lang.String" rules="14" />
	</exitpoint>
	<!-- org.hibernate.Session 3x -->
	<!-- net.sf.hibernate.Session 2x -->
	<exitpoint id="15">
		<qualifiedname><![CDATA[(org|net.sf).hibernate.Session]]></qualifiedname>
		<methodname>createSQLQuery</methodname>
		<parameters type="java.lang.String" rules="14" />
	</exitpoint>
	<exitpoint id="16">
		<qualifiedname><![CDATA[(org|net.sf).hibernate.Session]]></qualifiedname>
		<methodname>createQuery</methodname>
		<parameters type="java.lang.String" rules="14" />
	</exitpoint>
	<exitpoint id="17">
		<qualifiedname><![CDATA[(org|net.sf).hibernate.Session]]></qualifiedname>
		<methodname>find</methodname>
		<parameters type="java.lang.String" rules="14" />
	</exitpoint>
	<exitpoint id="18">
		<qualifiedname><![CDATA[(org|net.sf).hibernate.Session]]></qualifiedname>
		<methodname>find</methodname>
		<parameters type="java.lang.String" rules="14" />
		<parameters type="java.lang.Object" rules="14" />
		<parameters type="java.lang.Object" rules="14" />
	</exitpoint>
	<exitpoint id="19">
		<qualifiedname><![CDATA[(org|net.sf).hibernate.Session]]></qualifiedname>
		<methodname>delete</methodname>
		<parameters type="java.lang.Object" rules="14" />
	</exitpoint>
	<exitpoint id="20">
		<qualifiedname><![CDATA[(org|net.sf).hibernate.Session]]></qualifiedname>
		<methodname>delete</methodname>
		<parameters type="java.lang.String" rules="14" />
		<parameters type="java.lang.Object" rules="14" />
		<parameters type="java.lang.Object" rules="14" />
	</exitpoint>
	<exitpoint id="21">
		<qualifiedname><![CDATA[(org|net.sf).hibernate.Session]]></qualifiedname>
		<methodname>save</methodname>
		<parameters type="java.lang.Object" rules="14" />
	</exitpoint>
	<exitpoint id="22">
		<qualifiedname><![CDATA[(org|net.sf).hibernate.Session]]></qualifiedname>
		<methodname>save</methodname>
		<parameters type="java.lang.Object" rules="14" />
	</exitpoint>
	<exitpoint id="23">
		<qualifiedname><![CDATA[(org|net.sf).hibernate.Session]]></qualifiedname>
		<methodname>save</methodname>
		<parameters type="java.lang.Object" rules="14" />
		<parameters type="java.lang.Object" rules="14" />
	</exitpoint>
	<exitpoint id="24">
		<qualifiedname><![CDATA[(org|net.sf).hibernate.Session]]></qualifiedname>
		<methodname>saveOrUpdate</methodname>
		<parameters type="java.lang.Object" rules="14" />
		<parameters type="java.lang.Object" rules="14" />
	</exitpoint>
	<exitpoint id="25">
		<qualifiedname><![CDATA[(org|net.sf).hibernate.Session]]></qualifiedname>
		<methodname>update</methodname>
		<parameters type="java.lang.Object" rules="14" />
	</exitpoint>
	<exitpoint id="26">
		<qualifiedname><![CDATA[(org|net.sf).hibernate.Session]]></qualifiedname>
		<methodname>update</methodname>
		<parameters type="java.lang.Object" rules="14" />
		<parameters type="java.lang.Object" rules="14" />
	</exitpoint>
	<exitpoint id="27">
		<qualifiedname><![CDATA[(org|net.sf).hibernate.Session]]></qualifiedname>
		<methodname>load</methodname>
		<parameters type="java.lang.Object" rules="14" />
		<parameters type="java.lang.Object" rules="14" />
	</exitpoint>
	<exitpoint id="28">
		<qualifiedname><![CDATA[(org|net.sf).hibernate.Session]]></qualifiedname>
		<methodname>load</methodname>
		<parameters type="java.lang.Object" rules="14" />
		<parameters type="java.lang.Object" rules="14" />
		<parameters type="java.lang.Object" rules="14" />
	</exitpoint>
</exitpoints>